[{"gameId":"mega_millions","eraId":"mega_millions_big_game_50_25_1996","earliestKnownDraw":"1996-09-06","latestKnownDraw":"1999-01-12","expectedDrawCount":172,"validatedDrawCount":172,"missingDrawCount":0,"conflictingDrawCount":0,"coveragePercent":100.0,"sourceStatus":"OFFICIAL_STATE_LOTTERY_ARCHIVE_VALIDATED","automationStatus":"MANUAL_BOOTSTRAP"},{"gameId":"mega_millions","eraId":"mega_millions_big_game_50_36_1999","earliestKnownDraw":"1999-01-15","latestKnownDraw":"2002-05-14","expectedDrawCount":348,"validatedDrawCount":348,"missingDrawCount":0,"conflictingDrawCount":0,"coveragePercent":100.0,"sourceStatus":"OFFICIAL_STATE_LOTTERY_ARCHIVE_VALIDATED","automationStatus":"MANUAL_BOOTSTRAP"},{"gameId":"mega_millions","eraId":"mega_millions_52_52_2002","earliestKnownDraw":"2002-05-17","latestKnownDraw":"2005-06-21","expectedDrawCount":324,"validatedDrawCount":324,"missingDrawCount":0,"conflictingDrawCount":0,"coveragePercent":100.0,"sourceStatus":"OFFICIAL_MULTI_SOURCE_RECONCILED","automationStatus":"MANUAL_BOOTSTRAP"},{"gameId":"mega_millions","eraId":"mega_millions_56_46_2005","earliestKnownDraw":"2005-06-24","latestKnownDraw":"2013-10-18","expectedDrawCount":869,"validatedDrawCount":869,"missingDrawCount":0,"conflictingDrawCount":0,"coveragePercent":100.0,"sourceStatus":"OFFICIAL_MULTI_SOURCE_RECONCILED","automationStatus":"MANUAL_BOOTSTRAP"},{"gameId":"mega_millions","eraId":"mega_millions_75_15_2013","earliestKnownDraw":"2013-10-22","latestKnownDraw":"2017-10-27","expectedDrawCount":420,"validatedDrawCount":420,"missingDrawCount":0,"conflictingDrawCount":0,"coveragePercent":100.0,"sourceStatus":"OFFICIAL_MULTI_SOURCE_RECONCILED","automationStatus":"MANUAL_BOOTSTRAP"},{"gameId":"mega_millions","eraId":"mega_millions_70_25_2017","earliestKnownDraw":"2017-10-31","latestKnownDraw":"2025-04-04","expectedDrawCount":776,"validatedDrawCount":776,"missingDrawCount":0,"conflictingDrawCount":0,"coveragePercent":100.0,"sourceStatus":"OFFICIAL_MULTI_SOURCE_RECONCILED","automationStatus":"MANUAL_BOOTSTRAP"},{"gameId":"mega_millions","eraId":"mega_millions_70_24_2025","earliestKnownDraw":"2025-04-08","latestKnownDraw":"2026-08-28","expectedDrawCount":146,"validatedDrawCount":146,"missingDrawCount":0,"conflictingDrawCount":0,"coveragePercent":100.0,"sourceStatus":"OFFICIAL_MULTI_SOURCE_RECONCILED","automationStatus":"MANUAL_BOOTSTRAP"}]
