[{"gameId":"powerball","eraId":"powerball_45_45_1992","earliestKnownDraw":"1992-04-22","latestKnownDraw":"1997-11-01","expectedDrawCount":578,"validatedDrawCount":578,"missingDrawCount":0,"conflictingDrawCount":0,"coveragePercent":100.0,"sourceStatus":"OFFICIAL_STATE_LOTTERY_PUBLISHED_ARCHIVE_VALIDATED","automationStatus":"MANUAL_BOOTSTRAP"},{"gameId":"powerball","eraId":"powerball_49_42_1997","earliestKnownDraw":"1997-11-05","latestKnownDraw":"2002-10-05","expectedDrawCount":514,"validatedDrawCount":514,"missingDrawCount":0,"conflictingDrawCount":0,"coveragePercent":100.0,"sourceStatus":"OFFICIAL_STATE_LOTTERY_PUBLISHED_ARCHIVE_VALIDATED","automationStatus":"MANUAL_BOOTSTRAP"},{"gameId":"powerball","eraId":"powerball_53_42_2002","earliestKnownDraw":"2002-10-09","latestKnownDraw":"2005-08-27","expectedDrawCount":302,"validatedDrawCount":302,"missingDrawCount":0,"conflictingDrawCount":0,"coveragePercent":100.0,"sourceStatus":"OFFICIAL_STATE_LOTTERY_PUBLISHED_ARCHIVE_VALIDATED","automationStatus":"MANUAL_BOOTSTRAP"},{"gameId":"powerball","eraId":"powerball_55_42_2005","earliestKnownDraw":"2005-08-31","latestKnownDraw":"2009-01-03","expectedDrawCount":350,"validatedDrawCount":350,"missingDrawCount":0,"conflictingDrawCount":0,"coveragePercent":100.0,"sourceStatus":"OFFICIAL_STATE_LOTTERY_PUBLISHED_ARCHIVE_VALIDATED","automationStatus":"MANUAL_BOOTSTRAP"},{"gameId":"powerball","eraId":"powerball_59_39_2009","earliestKnownDraw":"2009-01-07","latestKnownDraw":"2012-01-14","expectedDrawCount":316,"validatedDrawCount":316,"missingDrawCount":0,"conflictingDrawCount":0,"coveragePercent":100.0,"sourceStatus":"OFFICIAL_STATE_LOTTERY_PUBLISHED_ARCHIVE_VALIDATED","automationStatus":"MANUAL_BOOTSTRAP"},{"gameId":"powerball","eraId":"powerball_59_35_2012","earliestKnownDraw":"2012-01-18","latestKnownDraw":"2015-10-03","expectedDrawCount":388,"validatedDrawCount":388,"missingDrawCount":0,"conflictingDrawCount":0,"coveragePercent":100.0,"sourceStatus":"OFFICIAL_STATE_LOTTERY_PUBLISHED_ARCHIVE_VALIDATED","automationStatus":"MANUAL_BOOTSTRAP"},{"gameId":"powerball","eraId":"powerball_69_26_2015","earliestKnownDraw":"2015-10-07","latestKnownDraw":"2026-08-15","expectedDrawCount":1394,"validatedDrawCount":1394,"missingDrawCount":0,"conflictingDrawCount":0,"coveragePercent":100.0,"sourceStatus":"OFFICIAL_STATE_LOTTERY_PUBLISHED_ARCHIVE_VALIDATED","automationStatus":"MANUAL_BOOTSTRAP"}]
